date,site,category,title,url,publish_time,content
20260601,electrive_battery,电池,Graphite deal with Tesla: Syrah reports resolution in delivery dispute,https://www.electrive.com/2026/06/01/graphite-deal-with-tesla-syrah-reports-resolution-in-delivery-dispute/,2026-06-01 11:34:32,
20260601,ess_news,储能,Distribution grid locks up 455 GW of European battery storage projects,https://www.ess-news.com/2026/06/01/distribution-grid-locks-up-455-gw-of-european-battery-storage-projects/,2026-06-01 15:28:17,
20260601,ess_news,储能,Enertrag plans €1.1 billion French wind-and-battery hub buildout,https://www.ess-news.com/2026/06/01/enertrag-plans-e1-1-billion-french-wind-and-battery-hub-buildout/,2026-06-01 12:21:49,
20260601,ess_news,储能,Grenergy signs PPA for fifth phase of solar-plus-storage site in Chile,https://www.ess-news.com/2026/06/01/grenergy-signs-ppa-for-fifth-phase-of-hybrid-solar-plus-storage-site-in-chile/,2026-06-01 12:01:40,
20260601,ess_news,储能,Hoymiles launches new hybrid residential battery series,https://www.ess-news.com/2026/06/01/hoymiles-launches-new-hybrid-residential-battery-series/,2026-06-01 09:26:44,
20260601,ammonia_energy,氨,"Practical lessons, safety framework emerge from Rotterdam bunker demonstration",https://ammoniaenergy.org/articles/practical-lessons-safety-framework-emerge-from-rotterdam-bunker-demonstration/,2026-06-01 08:16:14,
20260601,ammonia_energy,氨,IMO approves safety guidelines for marine ammonia fuel,https://ammoniaenergy.org/articles/imo-approves-safety-guidelines-for-marine-ammonia-fuel/,2026-06-01 06:51:08,
20260601,ammonia_energy,氨,Renewable Fukushima demonstrator now operational,https://ammoniaenergy.org/articles/renewable-fukushima-demonstrator-now-operational/,2026-06-01 06:02:22,
20260601,ammonia_energy,氨,GEGHA construction under way in Australia,https://ammoniaenergy.org/articles/gegha-construction-under-way-in-australia/,2026-06-01 03:30:20,
20260601,hydrogen_tech_world,氢,"Ohmium, InSolare partner on 4 MW green hydrogen project for NLC India",https://hydrogentechworld.com/ohmium-insolare-partner-on-4-mw-green-hydrogen-project-for-nlc-india,2026-06-01 12:14:44,
20260601,electrek,新能源,"Volvo CE, Hitachi Energy set to partner on zero emission job sites",https://electrek.co/2026/06/01/volvo-ce-hitachi-energy-set-to-partner-on-zero-emission-job-sites/,2026-06-01 22:41:05,
20260601,electrek,新能源,Texas adds another huge solar farm as ERCOT grid demand soars,https://electrek.co/2026/06/01/texas-adds-another-huge-solar-farm-ercot-grid-demand-soars/,2026-06-01 22:22:21,
20260601,electrek,新能源,Toyota pulls the plug on one of its most important EVs,https://electrek.co/2026/06/01/toyota-pulls-plug-most-important-evs/,2026-06-01 21:50:19,
20260601,electrek,新能源,"BYD plans to bring all-solid-state batteries to EVs by 2027, but it’s not alone",https://electrek.co/2026/06/01/byd-all-solid-state-batteries-evs-by-2027/,2026-06-01 21:05:40,
20260601,electrek,新能源,"EcoFlow Hurricane Prep Sale offers 2,048Wh DELTA 2 Max power station $899, EGO 3,200 PSI pressure washer $699 low, more",https://electrek.co/2026/06/01/ecoflow-hurricane-prep-sale-2048wh-delta-2-max-power-station-ego-3200-psi-pressure-washer-more/,2026-06-01 18:00:00,
20260601,electrek,新能源,Hyundai is testing a new high-tech SDV setup for its upcoming EVs [Images],https://electrek.co/2026/06/01/hyundai-testing-new-sdv-setup-upcoming-evs-images/,2026-06-01 17:48:55,
20260601,electrek,新能源,Tesla FSD v14 is so good it’s making me dangerously complacent,https://electrek.co/2026/06/01/tesla-fsd-dangerously-good-complacency-problem/,2026-06-01 17:13:29,
20260601,electrek,新能源,"BYD’s overseas sales are booming, topping 160,000 for the first time in May",https://electrek.co/2026/06/01/byds-overseas-sales-surge-to-over-160000-first-time/,2026-06-01 16:30:04,
20260601,electrek,新能源,"Kia’s affordable EVs are catching on fast, but this could be the one to sell like ‘hotcakes’",https://electrek.co/2026/06/01/kias-affordable-evs-catch-on-ev2-sell-like-hotcakes/,2026-06-01 14:31:25,
20260601,electrek,新能源,"BYD will pay for crashes on its FSD competitor, something Tesla never has",https://electrek.co/2026/06/01/byd-gods-eye-accepts-liability-tesla-never-has/,2026-06-01 09:46:34,
20260601,electrek,新能源,A court just decided how much foot movement counts as ‘pedaling’ an e-bike,https://electrek.co/2026/05/31/a-court-just-decided-how-much-foot-movement-counts-as-pedaling-an-e-bike/,2026-06-01 06:13:10,
20260601,scitechdaily,综合科技,"Stress Can Literally Make You Lose Your Direction, According to New MRI Evidence",https://scitechdaily.com/stress-can-literally-make-you-lose-your-direction-according-to-new-mri-evidence/,2026-06-01 19:56:24,
20260601,scitechdaily,综合科技,Scientists Uncover a Hidden Alzheimer’s Target and Create the First Tool To Control It,https://scitechdaily.com/scientists-uncover-a-hidden-alzheimers-target-and-create-the-first-tool-to-control-it/,2026-06-01 19:21:25,
20260601,scitechdaily,综合科技,Scientists May Have Found a Completely New Way To Treat Depression,https://scitechdaily.com/scientists-may-have-found-a-completely-new-way-to-treat-depression/,2026-06-01 18:46:18,
20260601,scitechdaily,综合科技,Scientists Discover Surprising Similarities Between Freud’s Ideas and Modern Neuroscience,https://scitechdaily.com/scientists-discover-surprising-similarities-between-freuds-ideas-and-modern-neuroscience/,2026-06-01 16:27:35,
20260601,scitechdaily,综合科技,New 7-Dimensional Theory May Finally Solve the Black Hole Information Paradox,https://scitechdaily.com/new-7-dimensional-theory-may-finally-solve-the-black-hole-information-paradox/,2026-06-01 15:52:37,
20260601,scitechdaily,综合科技,The Missing Notebooks That Solved a 25-Year-Old Paleontology Mystery,https://scitechdaily.com/the-missing-notebooks-that-solved-a-25-year-old-paleontology-mystery/,2026-06-01 15:17:38,
20260601,scitechdaily,综合科技,Scientists Discover a Simple Writing Test That May Detect Cognitive Impairment,https://scitechdaily.com/scientists-discover-a-simple-writing-test-that-may-detect-cognitive-impairment/,2026-06-01 11:49:53,
20260601,scitechdaily,综合科技,Scientists Made Older Mice Biologically Younger Using Gut Microbes,https://scitechdaily.com/scientists-made-older-mice-biologically-younger-using-gut-microbes/,2026-06-01 11:14:16,
20260601,scitechdaily,综合科技,Scientists Finally Uncover Why Ozempic Stops Working for Some People,https://scitechdaily.com/scientists-finally-uncover-why-ozempic-stops-working-for-some-people/,2026-06-01 10:39:19,
20260601,netease_pv,光伏,李蔚&杨世和&周圆圆等人Joule全面解读：八面体畸变是Sn²⁺氧化的“真凶”：稳定晶格结构为全钙钛矿叠层电池开辟新路径,https://m.163.com/news/article/KUB1G7MQ0552LHQK.html?clickfrom=subscribe,2026-06-01 00:00:00,
20260601,netease_pv,光伏,福建师范大学章锦丹&项生昌&张章静AFM：层状氢键有机框架胶体粒子的倾斜晶格堆叠促进电荷分离并提高钙钛矿太阳能电池效率,https://m.163.com/news/article/KUB1G5SV0552LHQK.html?clickfrom=subscribe,2026-06-01 00:00:00,
20260601,netease_pv,光伏,中科院王吉政&于贵Angew：通过富电子共价有机框架自由基提升钙钛矿太阳能电池的效率与稳定性,https://m.163.com/news/article/KUB1G2LO0552LHQK.html?clickfrom=subscribe,2026-06-01 00:00:00,
20260601,cnnpn_domestic,核电国内,追求卓越·改革破局丨陆丰核电6号机组主设备全部吊装就位5月30日，由中核二三承建的陆丰核电6号机组，最后一台主设备——稳压器精准就位，标志着6号机组全部主设备吊装任务圆满收官。稳压器是反应堆冷却剂系统的定海神针，肩负着一回路压力控制与超压保护的关键使命，对吊装的精度与安全有着近乎严苛的要求。为确保吊装万无一失，项目部联合核反应堆公司统筹部署、精准施策，在汲取5号机组成熟经验的基础上，对吊装全过程实施精细化管控。从方案评审、流程梳理到制约项前置处理，每一个环节都经过反复推演、...2026-06-01,https://www.cnnpn.cn/article/54453.html,2026-06-01 00:00:00,
20260601,cnnpn_domestic,核电国内,广东陆丰核电5、6号机组项目建设信息公告,https://www.cnnpn.cn/article/23221.html,,
20260601,cnnpn_domestic,核电国内,汕尾市发布陆丰核电5、6号机组项目社会稳定风险评估信息公告,https://www.cnnpn.cn/article/23222.html,,
20260601,cnnpn_domestic,核电国内,三门核电3、4号机组最新进！拟采用CAP1000技术！,https://www.cnnpn.cn/article/26154.html,,
20260601,cnnpn_domestic,核电国内,宋海良拜会新疆维吾尔自治区党委书记马兴瑞、自治区主席艾尔肯·吐尼亚孜,https://www.cnnpn.cn/article/38683.html,,
20260601,cnnpn_domestic,核电国内,辽宁徐大堡核电3号机组顺利完成热态性能试验,https://www.cnnpn.cn/article/54492.html,,
20260601,cnnpn_domestic,核电国内,中国广核集团有限公司党委书记、董事长杨长利会见法国电力集团董事长兼首席执行官丰塔纳,https://www.cnnpn.cn/article/54464.html,,
20260601,cnnpn_domestic,核电国内,2026年度国际托卡马克物理与工程活动中方研讨会在上海召开,https://www.cnnpn.cn/article/54490.html,,
20260601,cnnpn_domestic,核电国内,华龙腾飞丨漳州核电4号机组堆腔换料水池模块吊装成功,https://www.cnnpn.cn/article/54467.html,,
20260601,cnnpn_domestic,核电国内,聚焦高端制造|秦川机床工具集团股份公司将于2022首届深圳核博会重磅亮相,https://www.cnnpn.cn/article/33333.html,,
20260601,cnnpn_domestic,核电国内,华东监督站开展宁德核电厂恶劣天气防护等专项检查,https://www.cnnpn.cn/article/54459.html,,
20260601,cnnpn_domestic,核电国内,2026年核仪器仪表交流研讨会在兰州成功召开,https://www.cnnpn.cn/article/54498.html,,
20260601,cnnpn_domestic,核电国内,深化合作，共赢未来 | 中核二三副总经理施发永一行拜访上海核工院,https://www.cnnpn.cn/article/54469.html,,
20260601,cnnpn_domestic,核电国内,烟台再添“国字号”重器：核电装备领域唯一国家级产业计量测试中心成立,https://www.cnnpn.cn/article/54479.html,,
20260601,cnnpn_domestic,核电国内,2026年第一期核电泵专业人员能力提升培训在四川成都成功举办,https://www.cnnpn.cn/article/54499.html,,
20260601,cnnpn_domestic,核电国内,田湾核电站天湾7号机组关键调试测试完成,https://www.cnnpn.cn/article/51008.html,,
20260601,cnnpn_international,核电国外,科技巨头Meta加速核电投资 与Vistra、Oklo和TerraPower达成三项新协议,https://www.cnnpn.cn/article/51137.html,,
20260601,cnnpn_international,核电国外,法国新一代核电站再次延期,https://www.cnnpn.cn/article/28235.html,,
20260601,cnnpn_international,核电国外,罗马尼亚切尔纳沃德核电站1号机组启动延寿改造,https://www.cnnpn.cn/article/50935.html,,
20260601,cnnpn_international,核电国外,BLSK Energy结束隐秘模式，计划回收核电站乏燃料生产先进快堆燃料,https://www.cnnpn.cn/article/54039.html,,
20260601,cnnpn_international,核电国外,ITER组织总干事在第三届ITER公私聚变合作论坛上表示：良性竞争有益领域发展，合作共促核聚变 产业前行,https://www.cnnpn.cn/article/53999.html,,
20260601,cnnpn_international,核电国外,法国电力公司（EDF）携手Mistral AI推进核能业务智能化，强调数字主权,https://www.cnnpn.cn/article/54489.html,,
20260601,cnnpn_international,核电国外,犹他州格林河核电站项目成立合资企业 将采用Holtec SMR-300小型模块化反应堆技术,https://www.cnnpn.cn/article/54411.html,,
20260601,cnnpn_international,核电国外,牛津西格玛与洛克伍德合作生产STEP聚变项目关键线圈原型,https://www.cnnpn.cn/article/54495.html,,
20260601,cnnpn_international,核电国外,日本关西电力完成大饭核电站3号机组新燃料组件运输,https://www.cnnpn.cn/article/54496.html,,
20260601,cnnpn_international,核电国外,日本关西电力公布核电站运行状况：美滨3号机组因蒸汽泄漏停运，多台机组处于定期检查中,https://www.cnnpn.cn/article/54497.html,,
20260601,cnnpn_international,核电国外,芬兰Steady Energy通讯和公共关系总监Lauri Muranen：到2050年芬兰将有20-30座小型核电站投入运营,https://www.cnnpn.cn/article/52864.html,,
20260601,cnnpn_international,核电国外,捷克两核电站年发电量创里程碑 突破32太瓦时发电量达到32.066太瓦时。,https://www.cnnpn.cn/article/50964.html,,
20260601,cnnpn_international,核电国外,波兰格丁尼亚港战略地块签约租赁，将生产首座核电站所需大型钢结构,https://www.cnnpn.cn/article/54484.html,,
20260601,cnnpn_international,核电国外,J&F投资公司聘请前Cemig首席执行官领导独立核能业务，负责与Eletronuclear的对接事务,https://www.cnnpn.cn/article/54486.html,,
20260601,cnnpn_international,核电国外,巴西核安全机构启动咨询程序，圣卡塔琳娜州或建设小型模块化反应堆,https://www.cnnpn.cn/article/54487.html,,
20260601,sciencenet,综合科技,1000多个物种的家园！巴西红藻石床蕴藏丰富生物多样性,https://news.sciencenet.cn/htmlnews/2026/6/565788.shtm,2026-06-01 00:00:00,
20260601,sciencenet,综合科技,“科学与中国——千名院士·千场科普”主场活动聚焦高亮度核科学,https://news.sciencenet.cn/htmlnews/2026/6/565787.shtm,2026-06-01 00:00:00,
20260601,sciencenet,综合科技,一种抗病毒药物将首次用于埃博拉病毒预防试验,https://news.sciencenet.cn/htmlnews/2026/6/565785.shtm,2026-06-01 00:00:00,
20260601,sciencenet,综合科技,专家学者探讨新能源发电并网运行与控制技术,https://news.sciencenet.cn/htmlnews/2026/6/565781.shtm,2026-06-01 00:00:00,
20260601,sciencenet,综合科技,一些棘龙会“流泪”,https://news.sciencenet.cn/htmlnews/2026/6/565778.shtm,2026-06-01 00:00:00,
20260601,xinhua_tech,综合科技,全国一体化算力网怎么建,https://www.news.cn/tech/20260601/f4ddc9df28a342ec8d7134d9a8c74a75/c.html,2026-06-01 00:00:00,
20260601,xinhua_tech,综合科技,外卖安全防线如何筑牢,https://www.news.cn/tech/20260601/695a7ee281e246d082202352588248ae/c.html,2026-06-01 00:00:00,
20260601,xinhua_tech,综合科技,财经聚焦|从2026智博会看智能产业发展新趋势,https://www.news.cn/tech/20260601/4048f7ea8cde45a588f6fba3b8a5b821/c.html,2026-06-01 00:00:00,
20260601,inen_solar,光伏,光伏「周事迹」国家能源局召开光伏等企业座谈会/“十五五”规划/华电/能建/阳光电源/天合/通威/隆基/晶澳/特变/太极实业,https://solar.in-en.com/html/solar-2460710.shtml,2026-06-01 00:00:00,
20260601,inen_solar,光伏,新疆哈密150兆瓦光热项目完成汽机扣盖一次成功,https://solar.in-en.com/html/solar-2460712.shtml,2026-06-01 00:00:00,
20260601,inen_solar,光伏,工信部：聚焦光伏组件、储能电池等重点产业链，开展专项节能监察,https://solar.in-en.com/html/solar-2460278.shtml,,
20260601,inen_solar,光伏,强强联合，通威与One Stop Warehouse达成合作,https://solar.in-en.com/html/solar-2460251.shtml,,
20260601,inen_solar,光伏,东方日升聘任新总裁,https://solar.in-en.com/html/solar-2460298.shtml,,
20260601,inen_solar,光伏,贵州2026年机制竞价结果：3814个光伏项目入选，电价0.345元/度,https://solar.in-en.com/html/solar-2460118.shtml,,
20260601,inen_solar,光伏,电价上涨25%！甘肃2027上半年机制电价竞价结果公布,https://solar.in-en.com/html/solar-2460133.shtml,,
20260601,inen_solar,光伏,招标 | 中石油300MW光伏项目EPC招标,https://solar.in-en.com/html/solar-2460142.shtml,,
20260601,inen_solar,光伏,光伏挣钱能力排行榜！阳光、特变、正泰、德业、捷佳伟创、横店东,https://solar.in-en.com/html/solar-2460253.shtml,,
20260601,inen_solar,光伏,组件最高0.845元/W！26个EPC项目！本周1.67GW光伏招中标项目【光,https://solar.in-en.com/html/solar-2460127.shtml,,
20260601,inen_solar,光伏,流标！400MW光伏治沙项目,https://solar.in-en.com/html/solar-2460297.shtml,,
20260601,inen_solar,光伏,招标 | 20450吨，浙能集团光伏支架招标,https://solar.in-en.com/html/solar-2460296.shtml,,
20260601,inen_solar,光伏,光伏出货排行榜！通威、阳光电源、晶科、中来、福莱特、福斯特、,https://solar.in-en.com/html/solar-2460295.shtml,,
20260601,inen_solar,光伏,新疆“十五五”规划纲要：系统谋划北疆大型新能源基地建设，有序,https://solar.in-en.com/html/solar-2460273.shtml,,
20260601,renewablesnow,新能源,Mirova secures debt financing for 88-MW Swedish wind portfolio,https://renewablesnow.com/news/mirova-secures-debt-financing-for-88-mw-swedish-wind-portfolio-1295706/,2026-06-01 00:00:00,
20260601,renewablesnow,新能源,Ecowende wind project off Netherlands installs first turbine,https://renewablesnow.com/news/ecowende-wind-project-off-netherlands-installs-first-turbine-1295718/,2026-06-01 00:00:00,
20260601,renewablesnow,新能源,Fugro to monitor marine mammals for EirGrid offshore programme,https://renewablesnow.com/news/fugro-to-monitor-marine-mammals-for-eirgrid-offshore-programme-1295663/,2026-06-01 00:00:00,
20260601,renewablesnow,新能源,Ammongas to deliver upgrading system for biomethane project in Spain,https://renewablesnow.com/news/ammongas-to-deliver-upgrading-system-for-biomethane-project-in-spain-1295653/,2026-06-01 00:00:00,
20260601,renewablesnow,新能源,Edisun shareholders back deal with Smartenergy,https://renewablesnow.com/news/edisun-shareholders-back-deal-with-smartenergy-1295652/,2026-06-01 00:00:00,
20260601,solarbe_tech,光伏,2026年欧盟碳关税怎么算？广东出口铝型材厂1年多交100万，三类广东出口工厂完整测算,https://news.solarbe.com/202606/01/50023772.html,2026-06-01 00:00:00,
20260601,solarbe_tech,光伏,0.973元/Wh！广东储能系统价格跌到历史低位，现在装到底能赚多少？,https://news.solarbe.com/202606/01/50023768.html,2026-06-01 00:00:00,
20260601,solarbe_tech,光伏,内蒙古自治区有序推动多用户绿电直连项目开发建设实施方案（试行）征求意见,https://news.solarbe.com/202606/01/50023736.html,2026-06-01 00:00:00,
20260601,solarbe_tech,光伏,内蒙古自治区鄂尔多斯市能源局启动2026年光伏治沙项目竞争性配置,https://news.solarbe.com/202606/01/50023726.html,2026-06-01 00:00:00,
20260601,solarbe_tech,光伏,4.5GW！山西2026年风光保障性并网项目清单公布,https://news.solarbe.com/202606/01/50023773.html,2026-06-01 00:00:00,
20260601,solarbe_tech,光伏,国家能源局：2026年4月全国可再生能源绿色电力证书核发及交易数据,https://news.solarbe.com/202606/01/50023735.html,2026-06-01 00:00:00,
20260601,solarbe_tech,光伏,1-4月逆变器出口同比增长34%!,https://news.solarbe.com/202606/01/50023731.html,2026-06-01 00:00:00,
20260601,solarbe_tech,光伏,云南能投修订投资管理制度：境内投资收益率6.5%~7%，风、光项目可适当降低,https://news.solarbe.com/202606/01/50023724.html,2026-06-01 00:00:00,
20260601,solarbe_tech,光伏,硅片降本空间见顶，光伏如何实现协作共赢、价值共生？,https://news.solarbe.com/202606/01/50023704.html,2026-06-01 00:00:00,
20260601,solarbe_tech,光伏,美国维持光伏产品 “双反” 壁垒！ 中方已出手！,https://news.solarbe.com/202606/01/50023738.html,2026-06-01 00:00:00,
20260601,solarbe_tech,光伏,印度首次否决中国光伏专家组设立申请！,https://news.solarbe.com/202606/01/50023739.html,2026-06-01 00:00:00,
20260601,solarbe_tech,光伏,云南能源集团万象纳蚌80MW光伏项目全容量并网,https://news.solarbe.com/202606/01/50023733.html,2026-06-01 00:00:00,
20260601,solarbe_tech,光伏,1~4月，43.5GW新能源项目完成分配，大唐、华能、华电规模最大！,https://news.solarbe.com/202606/01/50023728.html,2026-06-01 00:00:00,
20260601,solarbe_tech,光伏,协鑫集成取得光伏边框及组件专利，改善正面溢胶不良缺陷,https://news.solarbe.com/202606/01/50023743.html,2026-06-01 00:00:00,
20260601,solarbe_tech,光伏,宁波科论太阳能申请一种太阳能光伏支架结构专利，能够使得本太阳能光伏板固定以防止其角度偏移,https://news.solarbe.com/202606/01/50023741.html,2026-06-01 00:00:00,
20260601,china_nengyuan,新能源,中联重科履带起重机助力！我国核电建造,http://www.china-nengyuan.com/news/249135.html,,
20260601,china_nengyuan,新能源,中车株洲电机提供发电机 海西都兰400MW,http://www.china-nengyuan.com/news/249132.html,,
20260601,china_nengyuan,新能源,江山抽水蓄能电站下水库泄洪放空洞顺利,http://www.china-nengyuan.com/news/249128.html,,
20260601,china_nengyuan,新能源,昌宁：有序推进秸秆综合利用,http://www.china-nengyuan.com/news/249127.html,,
20260601,china_nengyuan,新能源,全球汽车巨头麦格纳正式入驻西安 为陕,http://www.china-nengyuan.com/news/249126.html,,
20260601,china_nengyuan,新能源,息县小茴店镇：秸秆'变废为宝' 绘就绿,http://www.china-nengyuan.com/news/249125.html,,
20260601,china_nengyuan,新能源,投资12亿美元，150MW的数据中心将落地,http://www.china-nengyuan.com/news/249069.html,,
20260601,china_nengyuan,新能源,澳大利亚首个8小时电池储能系统全面投,http://www.china-nengyuan.com/news/249062.html,,
20260601,china_nengyuan,新能源,SINTEF选择Power to Hydrogen供应AEM电,http://www.china-nengyuan.com/news/249005.html,,
20260601,china_nengyuan,新能源,南瑞继保供货的沙特SEC三期2.5吉瓦储能,http://www.china-nengyuan.com/news/248947.html,,
20260601,china_nengyuan,新能源,ELIRE Maritime联合体验证漂浮式氢能港,http://www.china-nengyuan.com/news/248923.html,,
20260601,china_nengyuan,新能源,低于化石燃料发电！光伏+储能成本降至74美元/MWh,http://www.china-nengyuan.com/news/247452.html,,
20260601,china_nengyuan,新能源,储能'反内卷'启动！融科储能领衔19,http://www.china-nengyuan.com/news/239583.html,,
20260601,china_nengyuan,新能源,中国领衔！2030年绿色经济年产值将,http://www.china-nengyuan.com/news/238728.html,,
20260601,china_nengyuan,新能源,促进压缩空气储能、二氧化碳储能、,http://www.china-nengyuan.com/news/237881.html,,
20260601,china_nengyuan,新能源,国家能源局关于促进新能源集成融合,http://www.china-nengyuan.com/news/237163.html,,
20260601,china_nengyuan,新能源,电池：游戏规则已经改变，但不是你想象的那样,http://www.china-nengyuan.com/news/247357.html,,
20260601,china_nengyuan,新能源,国家发展改革委 国家能源局关于促,http://www.china-nengyuan.com/news/236981.html,,
20260601,china_nengyuan,新能源,碳达峰碳中和的中国行动,http://www.china-nengyuan.com/news/236913.html,,
20260601,china_nengyuan,新能源,129家！工信部正式公布符合《光伏,http://www.china-nengyuan.com/news/236303.html,,
20260601,china_nengyuan,新能源,《节能降碳中央预算内投资专项管理,http://www.china-nengyuan.com/news/235277.html,,
20260601,china_nengyuan,新能源,超越电芯：深入分析电池储能成本的演变,http://www.china-nengyuan.com/news/247287.html,,
20260601,china_nengyuan,新能源,商务部：决定对稀土相关技术实施出,http://www.china-nengyuan.com/news/234848.html,,
20260601,china_nengyuan,新能源,工业和信息化部等八部门关于印发《,http://www.china-nengyuan.com/news/233784.html,,
20260601,china_nengyuan,新能源,碳交易重点领域全覆盖！中共中央办,http://www.china-nengyuan.com/news/232577.html,,
20260601,china_nengyuan,新能源,四川攀枝花：加快抽水蓄能、新型储,http://www.china-nengyuan.com/news/232130.html,,
20260601,china_nengyuan,新能源,智算双擎 新华三发布AI训推旗,http://www.china-nengyuan.com/news/248778.html,,
20260601,china_nengyuan,新能源,Aternium拟建设美国60MW氢气与,http://www.china-nengyuan.com/news/248914.html,,
20260601,china_nengyuan,新能源,兴燃500标方单槽PEM电解槽重磅,http://www.china-nengyuan.com/news/248899.html,,
20260601,china_nengyuan,新能源,濒临崩溃！为何电网正成为人工,http://www.china-nengyuan.com/news/248790.html,,
20260601,china_nengyuan,新能源,甘孜州首批绿色氢能共享两轮车,http://www.china-nengyuan.com/news/248901.html,,
20260601,china_nengyuan,新能源,兴燃科技与时代氢源签署战略合,http://www.china-nengyuan.com/news/248898.html,,
20260601,china_nengyuan,新能源,芯片圈热议车规标准：一轮'地,http://www.china-nengyuan.com/news/249079.html,,
20260601,china_nengyuan,新能源,全球生物质能源网改版公告,http://www.china-nengyuan.com/news/230690.html,,
20260601,china_nengyuan,新能源,全球首部液流电池百科全书—《中国液,http://www.china-nengyuan.com/news/210064.html,,
20260601,china_nengyuan,新能源,【重要】《中国氢能产业大全 2023-冬,http://www.china-nengyuan.com/news/192299.html,,
20260601,china_nengyuan,新能源,《氢能产业大全 2020》正式发布！,http://www.china-nengyuan.com/news/160270.html,,
20260601,china_nengyuan,新能源,华艺智慧连续五年获评'安徽省优秀建筑业企业',http://www.china-nengyuan.com/news/249138.html,,
20260601,china_nengyuan,新能源,增城城投集团旗下广州东部中心智能融合新型储,http://www.china-nengyuan.com/news/249116.html,,
20260601,china_nengyuan,新能源,投资约3亿元！赣州市储旭泰(全南)新能源独立,http://www.china-nengyuan.com/news/249115.html,,
