date,site,category,title,url,publish_time,content
20260504,electrive_battery,电池,Allan Swan appointed new CEO of ACC,https://www.electrive.com/2026/05/04/allan-swan-appointed-new-ceo-of-acc/,2026-05-04 12:45:00,
20260504,ess_news,储能,CATL expands into Australia with deal with Zinfra for battery storage projects,https://www.ess-news.com/2026/05/04/catl-expands-into-australia-with-deal-with-zinfra-for-battery-storage-projects/,2026-05-04 11:03:21,
20260504,ess_news,储能,USA: Western grid enters new era as CAISO launches Extended Day-Ahead Market,https://www.ess-news.com/2026/05/04/usa-western-grid-enters-new-era-as-caiso-launches-extended-day-ahead-market/,2026-05-04 08:15:00,
20260504,ess_news,储能,"Australia adds 350,000 residential batteries and 4.6 GWh in 10 months under subsidy-scheme",https://www.ess-news.com/2026/05/04/australia-adds-350000-residential-batteries-and-4-6-gwh-in-10-months-under-subsidy-scheme/,2026-05-04 07:09:00,
20260504,pv_magazine,光伏,"Free market, curtailment, and storage reshaping Brazilian solar sector",https://www.pv-magazine.com/2026/05/04/free-market-curtailment-and-storage-reshaping-brazilian-solar-sector/,2026-05-04 06:05:40,
20260504,ammonia_energy,氨,Four week retrofit for feeder container vessel to sail on ammonia,https://ammoniaenergy.org/articles/four-week-retrofit-for-feeder-container-vessel-to-sail-on-ammonia/,2026-05-04 06:48:04,
20260504,ammonia_energy,氨,Hynfra’s Egypt project expands,https://ammoniaenergy.org/articles/hynfras-egypt-project-expands/,2026-05-04 05:22:10,
20260504,ammonia_energy,氨,Siemens & Shomax: renewable fertilizers in north Texas,https://ammoniaenergy.org/articles/siemens-shomax-renewable-fertilizers-in-north-texas/,2026-05-04 01:38:56,
20260504,batteries_news,电池,"CENTURY LITHIUM ANNOUNCES MANAGEMENT APPOINTMENTS TO ADVANCE ANGEL ISLAND LITHIUM PROJECT, NEVADA",https://batteriesnews.com/century-lithium-announces-management-appointments-to-advance-angel-island-lithium-project-nevada/,2026-05-04 17:48:07,
20260504,batteries_news,电池,"ACC Appoints Allan Swan as Chief Executive Officer, Honors Retiring CEO Yann Vincent, and Reaffirms Shareholders’ Commitment to the Company’s Strategic Vision",https://batteriesnews.com/acc-appoints-allan-swan-as-chief-executive-officer-honors-retiring-ceo-yann-vincent-and-reaffirms-shareholders-commitment-to-the-companys-strategic-vision/,2026-05-04 17:37:32,
20260504,batteries_news,电池,"NUVVE JAPAN Appoints Shigeki Mori, Former THECOO CFO, as Executive Officer of Finance",https://batteriesnews.com/nuvve-japan-appoints-shigeki-mori-former-thecoo-cfo-as-executive-officer-of-finance/,2026-05-04 17:34:07,
20260504,batteries_news,电池,Marwynn Holdings Announces Strategic Expansion into Battery Recycling Infrastructure with Plans for EcoLoopX Black Mass Production Facility,https://batteriesnews.com/marwynn-holdings-announces-strategic-expansion-into-battery-recycling-infrastructure-with-plans-for-ecoloopx-black-mass-production-facility/,2026-05-04 17:28:48,
20260504,batteries_news,电池,"Forsee Power Delivers GO 1,6 Battery Systems to Tohatsu for Electric Water Pump Application",https://batteriesnews.com/forsee-power-delivers-go-16-battery-systems-to-tohatsu-for-electric-water-pump-application/,2026-05-04 17:25:28,
20260504,batteries_news,电池,"Uusnivala Energy Storage Oy, a 110MWh battery storage project managed by NTR has entered into a three-year agreement with ACCURE to maximise its performance, reduce operating costs and protect the lifetime value of the asset.",https://batteriesnews.com/uusnivala-energy-storage-oy-a-110mwh-battery-storage-project-managed-by-ntr-has-entered-into-a-three-year-agreement-with-accure-to-maximise-its-performance-reduce-operating-costs-and-protect-the-lif/,2026-05-04 17:21:31,
20260504,batteries_news,电池,Geolith Secures Strategic Investment from KBR to Accelerate Commercial Deployment of Direct Lithium Extraction,https://batteriesnews.com/geolith-secures-strategic-investment-from-kbr-to-accelerate-commercial-deployment-of-direct-lithium-extraction/,2026-05-04 17:18:36,
20260504,batteries_news,电池,EU – Advancing battery technology for electric vehicles and aircraft,https://batteriesnews.com/eu-advancing-battery-technology-for-electric-vehicles-and-aircraft/,2026-05-04 17:14:59,
20260504,batteries_news,电池,LG Energy Solution Inks 10 Trillion Won BMW Battery Deal,https://batteriesnews.com/lg-energy-solution-inks-10-trillion-won-bmw-battery-deal/,2026-05-04 17:10:43,
20260504,batteries_news,电池,Full Circle Lithium Advances Next-Generation Fire Safety with FCL-X™GEL for Global Battery Energy Storage Systems,https://batteriesnews.com/full-circle-lithium-advances-next-generation-fire-safety-with-fcl-xgel-for-global-battery-energy-storage-systems/,2026-05-04 17:07:38,
20260504,electrek,新能源,"1,000 curbside EV chargers are coming to Philadelphia",https://electrek.co/2026/05/04/1000-curbside-ev-chargers-philadelphia/,2026-05-04 22:32:11,
20260504,electrek,新能源,Kia’s EV bet is paying off as sales surge with new models launching,https://electrek.co/2026/05/04/kias-ev-bet-paying-off-sales-surge-new-models-launching/,2026-05-04 21:13:01,
20260504,electrek,新能源,Toyota announces new hydrogen collab with Nikola fueling spinoff,https://electrek.co/2026/05/04/toyota-announces-new-hydrogen-collab-with-nikola-fueling-spinoff/,2026-05-04 21:05:46,
20260504,electrek,新能源,Trump just blocked 165 US wind projects – here’s what’s behind it,https://electrek.co/2026/05/04/trump-just-blocked-165-us-wind-projects-heres-whats-behind-it/,2026-05-04 19:53:49,
20260504,electrek,新能源,"BYD’s flagship electric SUV receives 30,000+ orders in 24 hrs, and its starts at under $40K",https://electrek.co/2026/05/04/byds-flagship-electric-suv-secures-30000-orders-24-hours/,2026-05-04 19:48:16,
20260504,electrek,新能源,"Tesla Semi can save over $400K vs diesel, but there are big ‘ifs’",https://electrek.co/2026/05/04/tesla-semi-tco-analysis-diesel-savings-electricity-price/,2026-05-04 19:35:10,
20260504,electrek,新能源,"Nivalis buys SolarEdge, paving the way for solar powered reefer trailers in the US",https://electrek.co/2026/05/04/nivalis-buys-solaredge-paving-the-way-for-solar-powered-reefer-trailers-in-the-us/,2026-05-04 19:01:16,
20260504,electrek,新能源,"ENGWE EP-2 3.0 folding commuter e-bike with $214 bundle at new $949 low, Baseus X1 Pro dual-tracking solar camera $150 low, more",https://electrek.co/2026/05/04/engwe-ep-2-3-0-folding-commuter-e-bike-baseus-x1-pro-dual-tracking-solar-camera-more/,2026-05-04 18:00:00,
20260504,electrek,新能源,E-quipment highlight: New Holland E25X electric excavator,https://electrek.co/2026/05/04/e-quipment-highlight-new-holland-e25x-electric-excavator/,2026-05-04 17:59:38,
20260504,electrek,新能源,Ford is offering employee pricing and free EV chargers after sales crash again in April,https://electrek.co/2026/05/04/ford-offers-employee-pricing-free-ev-chargers-sales-drop/,2026-05-04 17:57:38,
20260504,electrek,新能源,"Kia is cutting EV6 prices by over $5,000",https://electrek.co/2026/05/04/kia-cutting-ev6-prices-over-5000/,2026-05-04 16:40:30,
20260504,electrek,新能源,Toyota takes a U-turn in ‘Haters Anthem’ ad to promote its new EVs [Video],https://electrek.co/2026/05/04/toyota-changes-tune-haters-anthem-ad-new-evs-video/,2026-05-04 15:30:42,
20260504,electrek,新能源,Nikola founder and convicted fraudster attacks Tesla Semi with some decent points,https://electrek.co/2026/05/04/nikola-founder-convicted-fraudster-trevor-milton-attacks-tesla-semi/,2026-05-04 14:36:38,
20260504,electrek,新能源,"NIO delivers 29,356 vehicles in April, but growth slows sharply from Q1 pace",https://electrek.co/2026/05/04/nio-april-2026-deliveries-growth-slows-es9-l80/,2026-05-04 14:18:01,
20260504,electrek,新能源,Toyota is about to reveal an upscale 3-row Lexus electric SUV [Images],https://electrek.co/2026/05/04/toyota-unveil-luxury-3-row-lexus-ev-suv-images/,2026-05-04 13:28:50,
20260504,electrek,新能源,Macfox X7 review: A street-legal UL-listed e-bike that feels like an electric moped,https://electrek.co/2026/05/04/macfox-x7-review-a-street-legal-ul-listed-e-bike-that-feels-like-an-electric-moped/,2026-05-04 11:38:01,
20260504,scitechdaily,综合科技,Scientists Discover Evolution’s 120-Million-Year-Old “Cheat Sheet”,https://scitechdaily.com/scientists-discover-evolutions-120-million-year-old-cheat-sheet/,2026-05-04 22:18:20,
20260504,scitechdaily,综合科技,This New “Sound Laser” Could Measure Gravity With Stunning Precision,https://scitechdaily.com/this-new-sound-laser-could-measure-gravity-with-stunning-precision/,2026-05-04 20:37:41,
20260504,scitechdaily,综合科技,Quantum Breakthrough: New Algorithm Solves “Impossible” Materials in Seconds,https://scitechdaily.com/quantum-breakthrough-new-algorithm-solves-impossible-materials-in-seconds/,2026-05-04 19:02:46,
20260504,scitechdaily,综合科技,Could the Universe’s Hidden Shape Solve One of Physics’ Biggest Mysteries?,https://scitechdaily.com/could-the-universes-hidden-shape-solve-one-of-physics-biggest-mysteries/,2026-05-04 18:27:43,
20260504,scitechdaily,综合科技,Rewriting Dinosaur Evolution: Scientists Unearth Remarkable 150-Million-Year-Old Stegosaur Skull,https://scitechdaily.com/rewriting-dinosaur-evolution-scientists-unearth-remarkable-150-million-year-old-stegosaur-skull/,2026-05-04 17:09:47,
20260504,scitechdaily,综合科技,Scientists Identify Two Simple Treatments for Cancer-Related Cognitive Impairment,https://scitechdaily.com/scientists-identify-two-simple-treatments-for-cancer-related-cognitive-impairment/,2026-05-04 15:26:13,
20260504,scitechdaily,综合科技,Omega-3 Supplements Linked to Cognitive Decline in Surprising New Study,https://scitechdaily.com/omega-3-supplements-linked-to-cognitive-decline-in-surprising-new-study/,2026-05-04 14:51:00,
20260504,scitechdaily,综合科技,One in Five at Risk: Scientists Identify a Hidden Blood Particle Linked to Higher Risk of Stroke and Death,https://scitechdaily.com/one-in-five-at-risk-scientists-identify-a-hidden-blood-particle-linked-to-higher-risk-of-stroke-and-death/,2026-05-04 14:16:14,
20260504,scitechdaily,综合科技,Darwin’s Islands Still Evolving: Giant Daisies Rewrite the Rules of Evolution,https://scitechdaily.com/darwins-islands-still-evolving-giant-daisies-rewrite-the-rules-of-evolution/,2026-05-04 11:15:38,
20260504,scitechdaily,综合科技,Ancient Document Confirms “Legendary” African King Actually Existed,https://scitechdaily.com/ancient-document-confirms-legendary-african-king-actually-existed/,2026-05-04 10:41:57,
20260504,scitechdaily,综合科技,"First-of-Its-Kind Discovery: Homer’s Iliad Found Embedded in a 1,600-Year-Old Egyptian Mummy",https://scitechdaily.com/first-of-its-kind-discovery-homers-iliad-found-embedded-in-a-1600-year-old-egyptian-mummy/,2026-05-04 10:05:17,
20260504,scitechdaily,综合科技,Beyond Inflammation: Scientists Uncover New Cause of Persistent Rheumatoid Arthritis,https://scitechdaily.com/beyond-inflammation-scientists-uncover-new-cause-of-persistent-rheumatoid-arthritis/,2026-05-04 00:18:23,
20260504,interesting_engineering,综合科技,Eucalyptus bark waste finds new life as carbon filter for water and air cleaning,https://interestingengineering.com/innovation/eucalyptus-bark-carbon-filter,2026-05-04 23:40:53,
20260504,interesting_engineering,综合科技,Workshop-built magnetic heater delivers hot water without grid electricity,https://interestingengineering.com/energy/workshop-built-magnetic-induction-water-heater,2026-05-04 22:41:44,
20260504,interesting_engineering,综合科技,Ancient glassmaking method unlocks easier shaping of futuristic gas-trapping glass,https://interestingengineering.com/innovation/mof-glass-manufacturing-breakthrough,2026-05-04 21:05:20,
20260504,interesting_engineering,综合科技,UAE reports intercepting Iranian missiles and drones as Hormuz tensions escalate,https://interestingengineering.com/culture/uae-reports-iranian-missile-drone-intercepts,2026-05-04 19:06:11,
20260504,interesting_engineering,综合科技,"Al Wugeisha: Dubai’s 163-meter, 2,000-ton TBM excavates at 17 meters a day",https://interestingengineering.com/innovation/al-wugeisha-dubai-metro-blue-line-tunnel-boring-machine,2026-05-04 18:04:21,
20260504,interesting_engineering,综合科技,Scientists identify vortex rings as key to dolphin speed using a supercomputer,https://interestingengineering.com/science/scientists-identify-vortex-rings-as-key-to-dolphin-speed-using-a-supercomputer,2026-05-04 13:52:18,
20260504,interesting_engineering,综合科技,US Navy’s only submarine-launched nuclear missile to get tracking upgrade from L3Harris,https://interestingengineering.com/military/us-to-modernize-trident-ii-d5-missile,2026-05-04 13:12:24,
20260504,interesting_engineering,综合科技,DIY robot head inspired by Star Wars’ C-3PO droid comes to life with local AI,https://interestingengineering.com/ai-robotics/3d-printed-c3po-head-star-wars-droid,2026-05-04 12:34:52,
20260504,cnnpn_domestic,核电国内,中核同创医废等离子体处理设备正式发运近日，中核同创(成都)科技有限公司承接的医疗废物等离子处理设备顺利完成出厂预验收，正式起运。这是中核同创依托自主创新等离子体高温熔融技术，在危险废物无害化处置领域落地的又一标志性示范项目，彰显了企业在环保危废处理装备研发与应用领域的核心实力。该医疗废物等离子处理设备，搭载中核同创自主研发的等离子体高温熔融核心技术，能够对医疗废物实现彻底毁形灭菌，从源头阻断医疗废物带来的环境与健康风险。相较于传统处理方式，该装置兼具...2026-05-04,https://www.cnnpn.cn/article/53582.html,2026-05-04 00:00:00,
20260504,cnnpn_domestic,核电国内,山东核电有限公司总经理调整4月29日，山东核电有限公司发布《关于总经理发生变动的公告》称，根据国家电力投资集团有限公司人事公告，马元华不再担任公司总经理职务，由李建伟主持工作。马元华，男，1976年2月出生，大学本科。历任山东核电有限公司工程处、计划控制处处长，山东核电有限公司副总经理、山东核电有限公司党委副书记、总经理。李建伟，男，1973年6月出生，大学本科。历任山东核电有限公司调试管理部副经理、仪控维修处处长，山东核电有限公司副总经理，国电投核能有限公司...2026-05-04,https://www.cnnpn.cn/article/53601.html,2026-05-04 00:00:00,
20260504,cnnpn_domestic,核电国内,关键技术加快突破 四川聚变科创加速成势‘五一’假期后，将会有千名科研人员整体入驻天府聚变技术研发中心。核工业西南物理研究院聚变技术研究所所长张龙表示，目前中心已开始开展包括国际热核聚变实验堆(ITER)第一壁部件连续热负荷考核、氦冷回路实验等在内的多项关键实验，向开展燃烧实验和建设聚变工程实验堆目标迈进。4月30日，核工业西南物理研究院聚变技术研究所所长张龙介绍国际热核聚变实验堆(ITER)第一壁部件。新华社记者 李力可 摄聚变能因原料丰富、清洁安...2026-05-04,https://www.cnnpn.cn/article/53600.html,2026-05-04 00:00:00,
20260504,cnnpn_domestic,核电国内,中广核广东太平岭核电厂2号机组首次核燃料装载工作圆满完成,https://www.cnnpn.cn/article/53599.html,,
20260504,cnnpn_domestic,核电国内,中核同创医废等离子体处理设备正式发运,https://www.cnnpn.cn/article/53582.html,,
20260504,cnnpn_domestic,核电国内,山东核电有限公司总经理调整,https://www.cnnpn.cn/article/53601.html,,
20260504,cnnpn_domestic,核电国内,关键技术加快突破 四川聚变科创加速成势,https://www.cnnpn.cn/article/53600.html,,
20260504,cnnpn_domestic,核电国内,架构设计强根基，数字转型促发展——中国原子能召开企业架构设计专题培训会,https://www.cnnpn.cn/article/53597.html,,
20260504,cnnpn_domestic,核电国内,追求卓越·改革破局 | 中核海外召开卓越绩效贯标推广工作领导小组会议,https://www.cnnpn.cn/article/53590.html,,
20260504,cnnpn_domestic,核电国内,华龙一号“核”力赋能自贸港 昌江核电3号机组开始首次装料,https://www.cnnpn.cn/article/53592.html,,
20260504,cnnpn_domestic,核电国内,秦山核电秦三厂213大修开始,https://www.cnnpn.cn/article/53596.html,,
20260504,cnnpn_domestic,核电国内,筑牢安全发展根基，深化精益经营管理，江苏核电召开股东会第五十七次会议暨第九届董事会第九次会议并组织董事专题调研,https://www.cnnpn.cn/article/53594.html,,
20260504,cnnpn_domestic,核电国内,福清核电208大修开始,https://www.cnnpn.cn/article/53598.html,,
20260504,cnnpn_domestic,核电国内,硬核开局！江苏核电全面参与江苏省不间断现货交易运行,https://www.cnnpn.cn/article/53595.html,,
20260504,cnnpn_domestic,核电国内,宁德核电开展“五一”节前安全大检查,https://www.cnnpn.cn/article/53593.html,,
20260504,cnnpn_domestic,核电国内,国际合作 | 中国聚变赴法国出席ITER第三届核聚变公私合作研讨会,https://www.cnnpn.cn/article/53589.html,,
20260504,cnnpn_domestic,核电国内,田湾核电OT116大修正式开始,https://www.cnnpn.cn/article/53591.html,,
20260504,cnnpn_domestic,核电国内,核聚变中心率团赴国际原子能机构出席聚变人才队伍建设技术会议,https://www.cnnpn.cn/article/53583.html,,
20260504,cnnpn_international,核电国外,韩国探讨小型模块化反应堆船舶公私合作措施,https://www.cnnpn.cn/article/53565.html,,
20260504,cnnpn_international,核电国外,Terra Innovatum与Conuar合作推进SOLO反应堆制造,https://www.cnnpn.cn/article/53569.html,,
20260504,cnnpn_international,核电国外,法国Stellaria与CEA就建Alvin实验堆可行性研究磋商,https://www.cnnpn.cn/article/53500.html,,
20260504,cnnpn_international,核电国外,美国利用超级计算机训练AI模型捕捉等离子体磁湍流细节,https://www.cnnpn.cn/article/53343.html,,
20260504,cnnpn_international,核电国外,韩国开发出测量核电站设备大气腐蚀新技术,https://www.cnnpn.cn/article/53367.html,,
20260504,cnnpn_international,核电国外,AtkinsRéalis确认CANDU® Monark反应堆功率等级,https://www.cnnpn.cn/article/53336.html,,
20260504,cnnpn_international,核电国外,俄罗斯国家原子能公司完成世界上第一个放射性废物焚烧项目,https://www.cnnpn.cn/article/53405.html,,
20260504,cnnpn_international,核电国外,韩国庆尚北道庆州市将建辐射环境机器人示范中心,https://www.cnnpn.cn/article/53519.html,,
20260504,cnnpn_international,核电国外,Terra Innovatum与Mersen成功生产石墨反应堆堆芯原型,https://www.cnnpn.cn/article/53204.html,,
20260504,cnnpn_international,核电国外,Oklo与英伟达等合作开发核动力AI工厂及推进核燃料验证,https://www.cnnpn.cn/article/53459.html,,
20260504,cnnpn_international,核电国外,芬兰Steady Energy通讯和公共关系总监Lauri Muranen：到2050年芬兰将有20-30座小型核电站投入运营,https://www.cnnpn.cn/article/52864.html,,
20260504,cnnpn_international,核电国外,美国空军先进核能计划（ANPI）选定三家微堆供应商，最早2028年部署,https://www.cnnpn.cn/article/53573.html,,
20260504,cnnpn_international,核电国外,俄乌联合工作组会议聚焦乌核工业人才培养,https://www.cnnpn.cn/article/53547.html,,
20260504,cnnpn_international,核电国外,俄罗斯举办AI在核工业应用科学实践研讨会,https://www.cnnpn.cn/article/53546.html,,
20260504,cnnpn_international,核电国外,美欧新项目框架推进聚变能源研究合作,https://www.cnnpn.cn/article/53537.html,,
20260504,inen_solar,光伏,PE资本与光伏电池龙头联手！重整“光伏组件第一股”,https://solar.in-en.com/html/solar-2459860.shtml,,
20260504,inen_solar,光伏,中石油7GW光伏组件集采：通威、隆基、天合、正泰新能、英利、协,https://solar.in-en.com/html/solar-2459817.shtml,,
20260504,inen_solar,光伏,贵州2026年机制电价竞价启动：电价0.19~0.345元/度，电量153亿度,https://solar.in-en.com/html/solar-2459778.shtml,,
20260504,inen_solar,光伏,国家能源局：一季度分布式光伏新增装机21.57GW，集中式新增19.62,https://solar.in-en.com/html/solar-2459845.shtml,,
20260504,inen_solar,光伏,阿特斯终止14GW单晶硅片项目,https://solar.in-en.com/html/solar-2459875.shtml,,
20260504,inen_solar,光伏,暴涨28%之后突然跌停！硅料价格坐了半个月“过山车”,https://solar.in-en.com/html/solar-2459819.shtml,,
20260504,inen_solar,光伏,招标 | 中广核8.4GW光伏组件集采招标,https://solar.in-en.com/html/solar-2459820.shtml,,
20260504,inen_solar,光伏,情绪提振市场 本周多晶硅价格止跌企稳,https://solar.in-en.com/html/solar-2459732.shtml,,
20260504,inen_solar,光伏,广西“十五五”规划纲要：推动主要流域“水风光”一体化发展,https://solar.in-en.com/html/solar-2459897.shtml,,
20260504,inen_solar,光伏,国家电网与四川省委省政府举行会谈并签署战略合作框架协议,https://solar.in-en.com/html/solar-2459909.shtml,,
20260504,inen_solar,光伏,风光新能源最大IPO来了！华润新能成功过会！,https://solar.in-en.com/html/solar-2459908.shtml,,
20260504,renewablesnow,新能源,Uniper wins preliminary nod for 890-MW hydrogen-ready gas power plant,https://renewablesnow.com/news/uniper-wins-preliminary-nod-for-890-mw-hydrogen-ready-gas-power-plant-1294059/,2026-05-04 00:00:00,
20260504,renewablesnow,新能源,GE Vernova to supply pumped-storage units for 1.35-GW Indian project,https://renewablesnow.com/news/ge-vernova-to-supply-pumped-storage-units-for-1-35-gw-indian-project-1294113/,2026-05-04 00:00:00,
20260504,renewablesnow,新能源,Poland's R.Power to provide electricity storage services to Axpo,https://renewablesnow.com/news/polands-r-power-to-provide-electricity-storage-services-to-axpo-1294109/,2026-05-04 00:00:00,
20260504,renewablesnow,新能源,"Brussels clears EDF, Eurus JV for 120-MW BESS project in Poland",https://renewablesnow.com/news/brussels-clears-edf-eurus-jv-for-120-mw-bess-project-in-poland-1294106/,2026-05-04 00:00:00,
20260504,renewablesnow,新能源,GreenYellow flips switch on 14.55-MWp solar farm in Colombia,https://renewablesnow.com/news/greenyellow-flips-switch-on-14-55-mwp-solar-farm-in-colombia-1294119/,2026-05-04 00:00:00,
20260504,renewablesnow,新能源,"IFC, Norfund prepare USD-83.2m financing for solar mini-grids in Nigeria",https://renewablesnow.com/news/ifc-norfund-prepare-usd-83-2m-financing-for-solar-mini-grids-in-nigeria-1294115/,2026-05-04 00:00:00,
20260504,renewablesnow,新能源,"50Hertz, partners to build 120 MW power-to-heat facility in Germany",https://renewablesnow.com/news/50hertz-partners-to-build-120-mw-power-to-heat-facility-in-germany-1294103/,2026-05-04 00:00:00,
20260504,renewablesnow,新能源,Eurus starts demolition works on 57-MW wind plant in Hokkaido,https://renewablesnow.com/news/eurus-starts-demolition-works-on-57-mw-wind-plant-in-hokkaido-1294105/,2026-05-04 00:00:00,
20260504,renewablesnow,新能源,"Australia selects 2.4 GW of renewables, BESS in CIS 5 and 6 tenders",https://renewablesnow.com/news/australia-selects-2-4-gw-of-renewables-bess-in-cis-5-and-6-tenders-1294065/,2026-05-04 00:00:00,
20260504,renewablesnow,新能源,Orlen to start seabed survey for 4-GW Baltic West off Poland,https://renewablesnow.com/news/orlen-to-start-seabed-survey-for-4-gw-baltic-west-off-poland-1294049/,2026-05-04 00:00:00,
20260504,renewablesnow,新能源,"IFM's Mobius acquires Air Liquide’s biogas assets in US, Europe",https://renewablesnow.com/news/ifms-mobius-acquires-air-liquides-biogas-assets-in-us-europe-1294082/,2026-05-04 00:00:00,
20260504,tgs4c,综合科技,Seagreen highlights Montrose’s offshore wind role during royal visit,https://www.tgs4c.com/news/seagreen-highlights-montrose92s-offshore-wind-role-during-royal-visit-nid32714.html,2026-05-04 00:00:00,
20260504,china_nengyuan,新能源,四大场景落地！微电网有望迎来指数级增,http://www.china-nengyuan.com/news/247271.html,,
20260504,china_nengyuan,新能源,思源弘瑞助力陕西首个光伏电源侧储能工,http://www.china-nengyuan.com/news/247270.html,,
20260504,china_nengyuan,新能源,宁波市储能发展学会走访副会长单位共探,http://www.china-nengyuan.com/news/247262.html,,
20260504,china_nengyuan,新能源,江苏：分布式光伏装机有望突破2000万千,http://www.china-nengyuan.com/news/247259.html,,
20260504,china_nengyuan,新能源,最新预测：今年我国光伏装机规模将首超,http://www.china-nengyuan.com/news/247257.html,,
20260504,china_nengyuan,新能源,光伏行业仍承压 差异化技术等成扭转变,http://www.china-nengyuan.com/news/247256.html,,
20260504,china_nengyuan,新能源,伊朗为何威胁OpenAI的'星际之门'项目,http://www.china-nengyuan.com/news/247286.html,,
20260504,china_nengyuan,新能源,西班牙电池储能项目储备量同比增长464%,http://www.china-nengyuan.com/news/247285.html,,
20260504,china_nengyuan,新能源,新加坡呼吁增加发电能力，以满足日益增,http://www.china-nengyuan.com/news/247283.html,,
20260504,china_nengyuan,新能源,本田推迟纯电动车配备AI自动驾驶技术计,http://www.china-nengyuan.com/news/247267.html,,
20260504,china_nengyuan,新能源,特斯拉将Model Y L推向印度 计划6月份,http://www.china-nengyuan.com/news/247252.html,,
