date,site,category,title,url,publish_time,content
20260630,electrive_battery,电池,Researchers aim to regenerate EV battery electrodes instead of recycling them,https://www.electrive.com/2026/06/30/researchers-aim-to-regenerate-ev-battery-electrodes-instead-of-recycling-them/,2026-06-30 14:00:00,
20260630,electrive_battery,电池,Germany accelerates Northvolt asset sale to Lyten,https://www.electrive.com/2026/06/30/germany-accelerates-northvolt-asset-sale-to-lyten/,2026-06-30 08:44:26,
20260630,ess_news,储能,"Eku Energy plans 1,600 MWh battery storage project in Germany",https://www.ess-news.com/2026/06/30/eku-energy-plans-1600-mwh-battery-storage-project-in-germany/,2026-06-30 14:00:00,
20260630,ess_news,储能,Iberdrola expands with US battery project,https://www.ess-news.com/2026/06/30/iberdrola-expands-with-us-battery-project/,2026-06-30 13:00:00,
20260630,ess_news,储能,Allume launches SolShare 2 with community battery integration,https://www.ess-news.com/2026/06/30/allume-launches-solshare-2-with-community-battery-integration/,2026-06-30 11:00:00,
20260630,ess_news,储能,"Enlight raises $2.6 billion for CO Bar solar and BESS complex, reaches financial close",https://www.ess-news.com/2026/06/30/enlight-raises-2-6-billion-for-co-bar-solar-and-bess-complex-reaches-financial-close/,2026-06-30 09:00:00,
20260630,ess_news,储能,Envision to supply 660 MWh BESS for South Africa’s Naos-1,https://www.ess-news.com/2026/06/30/envision-to-supply-660-mwh-bess-for-south-africas-naos-1/,2026-06-30 07:58:00,
20260630,ess_news,储能,Toyota Tsusho wins EPC deal for Benin solar battery project,https://www.ess-news.com/2026/06/30/toyota-tsusho-wins-epc-deal-for-benin-solar-battery-project/,2026-06-30 07:15:00,
20260630,ess_news,储能,Argentine province building distributed solar plants with storage,https://www.ess-news.com/2026/06/30/argentine-province-building-distributed-solar-plants-with-storage/,2026-06-30 06:30:00,
20260630,ammonia_energy,氨,JERA finalizes agreements for fuel ammonia transport to Japan,https://ammoniaenergy.org/articles/jera-finalizes-agreements-for-fuel-ammonia-transport-to-japan/,2026-06-30 07:33:37,
20260630,ammonia_energy,氨,H-Power inks commercial supply deal for hydrogen produced from cracked ammonia,https://ammoniaenergy.org/articles/h-power-inks-commercial-supply-deal-for-hydrogen-produced-from-cracked-ammonia/,2026-06-30 06:56:33,
20260630,ammonia_energy,氨,Facet Amtech awarded funding to scale-up novel catalyst technology,https://ammoniaenergy.org/articles/facet-amtech-awarded-funding-to-scale-up-novel-catalyst-technology/,2026-06-30 04:46:01,
20260630,h2_view,氢,- gasworld,https://news.google.com/rss/articles/CBMi9wFBVV95cUxNT19VZWFaNXl4ZEVoUURzcV9IdHJSUDVxZmc3bS1SRGVzRkJINk1WWkRsOXMyUVdSNE5mRmJPS2hlN3JpaVcwbFR0RnQ1Tm0tNnRzVWlpWXhVMmdJd19yNUJJNWlZSFR1UHVGd3kwUUVBQ2tSZnlpdm9ianp6UG96ZFFNMkRzaWVJX2w3Z3ZFc18wN21zSTBjTmhWR1NxSWhtekR4a2VRZGFjTlRxMVd6T1lJbnM4RlYtWWh3UlRXOU5DR2xnUXRibHpRVTJEcG5FUUMzVEloMFZEeEJ0SVh6eHByV1R0ZERaOWtYRnV4OTM3eFpOUjNZ?oc=5,2026-06-30 02:52:25,
20260630,h2_view,氢,- gasworld,https://news.google.com/rss/articles/CBMihAJBVV95cUxNb1JxcUhUUDNnUVBNbFpxNElLRmREajhNRldSMUpKa0JUZF9EQmdBbi0za0otcERYMF9jMWlmWWhMZHdrWDZtckRvbEdSQVhNdWZKX3V0U2V3YnVIQjNEbXlCVlU2M0ZnMW9JcUtfaEJlSmR2eWtqcGdVTDk4ZWFDN2thWXNxWk52eVhaR0MyWDhtQmtSTU1UX0FnamVTeGdkaXVXcnNUTjRwWVgyNkZlc1FWNnBJeWJvbzJVV0hiX3BBYVlQSXhYeGFMYVR5WG1QU0NJVEpPUXZxWGlnYXZGLVRTRXU4QTJsekpHNGVGT1djTlBjQ1o4b1FUU1FUVTNTeS1BMw?oc=5,2026-06-30 00:52:24,
20260630,h2_view,氢,- gasworld,https://news.google.com/rss/articles/CBMi6AFBVV95cUxOT3picFJvM3FGYnpqTUxabXUzSWxMc25CcGF2U0VIcjBDb1ZybkNfN29CWVhVUlowRzExRkFZajNIOHEwQ1pKTmVSZnY0SkJocWppNG8xS1pBQTltMHliQm5jeDZ1d1d0Nlh3LVByQzhWc0lPUEVMV2toZDRBVGRCUDJIc0Jpd21ROHNwTFUyckVEa2taTHNoc3RCS2pHblM0YzlhenViMWZGaWY5MmJSckgzU2pFT1EwQjk5OWNWeDNRX3g5S3JNOUFXdmVlMk5UVVBOMHRvZk5wRUxxRUFUdDRjQTRMZlBu?oc=5,2026-06-30 04:22:30,
20260630,h2_view,氢,- gasworld,https://news.google.com/rss/articles/CBMijwJBVV95cUxPazJLV0l4M2o4OUVQYjZRT0ZZWWk0RFlyNm80NjA5VVQydjcxMWk2RzhSVlBqQ0Jsa1ZQZzlSckJLU195WUdGdjJzaGN6eHRteDVESFJLODV2aGMyaTNNVkNoSE5Oa0pDc2VhRl8tZ04tb1lTMk8wQU5reDZBTmxCUVJDbzFxdUd3eG1BY3lOTzJibWZoZVR4dy1EbThwUkdzUXdBcmFEckgzV2VuQ1B1NkZmZnpWMVhIOURlSmpUbnQ1dUNVakthOUlUUldoTm9pZnFxeUJjMk5ZX3VzV0k1LV9QS0w5cHUtZVU1MlFmQ0ZjUXMxeDRlZlFJUktpTEstUW1LRFg2cVNiZ0F2T2lR?oc=5,2026-06-30 00:35:24,
20260630,h2_view,氢,- gasworld,https://news.google.com/rss/articles/CBMihwJBVV95cUxNZEVTRzlkazJTdXhYTm40WVU4WXRyQWhPa0RxcnhhbFpxQU5yc0Q3UlNRS0NRQXFlSnktQU5NYVJpR2gyMUxvbVBlODREdjVzSzg0THBMX0JPLVkxWWp5N3JaSlhlMTAwZXVib0ZTdmIxblpUSk5qT2RRX2kwSDJDXzR3cGxRaFpUU3o1ajhMaUdiNlFXUEJDRFp4Tk5OWEZKNVdjYk52cmNvWE1kcWVFOVdQV2xlMHlxel8yTFRTdXVOS0JVT2U3MWJKdTVpalBTLTlmUUlNbHpGN3RiRmhWNXdPUy1Bbm5KdUlZaFRPaUthcGFUSWZpZjVISlVGek0wS0p5TWo5cw?oc=5,2026-06-30 00:55:24,
20260630,h2_view,氢,- gasworld,https://news.google.com/rss/articles/CBMi6AFBVV95cUxNRzZpM3kyaVpsQ2FJWnhDTGlvdlZSSzk1b3BaazNpMk5BU0ZmWmFHNVNYMFdsN0pDWVdiMGRvM0hJOU9Yd0UwdXQ4UGl1SmpCeFJSZFgzTGJoU3EzVTJEc01fek9KUkxVMFFpNm1qMERMN0JlOWxUcGR5RDd3ejFtSUNtYjJjcVVUd3VKVHhiWmNTVU9adkQxLUx1bVdGWUxaUUprN1FYQ3VTQ0pMWnIyTGx3MHN5VGN3LWwtYzBUU1Fhb2VQQWxUR1AwQi14WTFWMVJhR1R3ZDlNLWZueHRpekU5UmZPLVJI?oc=5,2026-06-30 23:19:24,
20260630,h2_view,氢,- gasworld,https://news.google.com/rss/articles/CBMiiAJBVV95cUxQNE1SUkNDYTJSNUlWNG9YQ1VkU21PWWNYNFRWOUFidmxRdXpoOW16UWFBdWFPaGRoME03aHc3VzlOYmNMRmVuUHdsRmNYcTBtTW50V2xONy1XVDQyUlQzdHhtYllsMnRoSFRBYTUtU0NHTlRrQXNZS1BSbVRjWkx4Y0Vvb1ZwTVhLck53ZUIzT0x2Ui1uenpJdU5UM0xTVEFGQV9UbFBueHlSNm9GOGZHcXNtZUNSM21Zc19NRUN4RmtEUkNCN0RMMC1oajZDd01vVlZTRHU3c2Nwd01JQmFUMDVsbTNpT3ktNjBoVGVyRm94cWdLTWdjN0hjSGxQVmthMFNrdVlQRlI?oc=5,2026-06-30 13:10:54,
20260630,hydrogen_tech_world,氢,SAFE compression technology supports Sicily hydrogen project,https://hydrogentechworld.com/safe-compression-technology-supports-sicily-hydrogen-project,2026-06-30 09:56:30,
20260630,hydrogen_tech_world,氢,"Next Hydrogen, FFC deepen fusion collaboration",https://hydrogentechworld.com/next-hydrogen-ffc-deepen-fusion-collaboration,2026-06-30 09:30:32,
20260630,electrek,新能源,Genesis confirms the GV90 launch date as its ultra-luxe SUV nears arrival,https://electrek.co/2026/06/30/genesis-confirms-gv90-launch-date-debut/,2026-06-30 21:37:14,
20260630,electrek,新能源,Controversial Ferrari Luce EV is an instant sellout in China [update],https://electrek.co/2026/06/30/controversial-ferrari-luce-ev-is-an-instant-sellout-in-china/,2026-06-30 20:55:00,
20260630,electrek,新能源,"$383 million port and freight infrastructure grant to create 22,000 clean jobs",https://electrek.co/2026/06/30/383-million-port-and-freight-infrastructure-grant-to-create-22000-clean-jobs/,2026-06-30 20:29:42,
20260630,electrek,新能源,Big Short’s Michael Burry discloses new Tesla (TSLA) position,https://electrek.co/2026/06/30/michael-burry-tesla-short-416/,2026-06-30 20:24:37,
20260630,electrek,新能源,The Chevy Blazer EV avoids a price hike for 2027 despite a few upgrades,https://electrek.co/2026/06/30/chevy-blazer-ev-avoids-price-hike-2027-despite-upgrades/,2026-06-30 20:09:38,
20260630,electrek,新能源,Solar gets railed: clever Swiss pilot proves PV panels and trains can coexist,https://electrek.co/2026/06/30/solar-gets-railed-clever-swiss-pilot-proves-pv-panels-and-trains-can-coexist/,2026-06-30 18:46:21,
20260630,electrek,新能源,Tesla poaches 17-year Intel veteran to lead its ‘Terafab’ chip plant,https://electrek.co/2026/06/30/tesla-intel-veteran-terafab-director/,2026-06-30 18:31:24,
20260630,electrek,新能源,Electrify America is adding NACS chargers to more of its busiest stations,https://electrek.co/2026/06/30/electrify-america-nacs-chargers/,2026-06-30 18:13:22,
20260630,electrek,新能源,BYD’s flagship electric SUV is so smooth that it won an anti-motion-sickness certification,https://electrek.co/2026/06/30/byds-flagship-electric-suv-wins-anti-motion-sickness-certification/,2026-06-30 18:02:06,
20260630,electrek,新能源,"Tenways Wayfarer cruiser e-bike bundle at new $1,649 low ($827 off), Jackery July 4th power station sale, Aiper, Greenworks, more",https://electrek.co/2026/06/30/tenways-wayfarer-cruiser-e-bike-jackery-july-4th-power-station-sale-aiper-greenworks-more/,2026-06-30 18:00:00,
20260630,electrek,新能源,"The BMW iX5 sets the benchmark with 525 miles of range, fast charging [Images]",https://electrek.co/2026/06/30/bmw-ix5-sets-benchmark-with-525-miles-range-images/,2026-06-30 16:50:54,
20260630,electrek,新能源,You can now check when you’ll be able to order your Rivian R2,https://electrek.co/2026/06/30/you-can-now-check-when-youll-be-able-to-order-your-rivian-r2/,2026-06-30 16:33:16,
20260630,electrek,新能源,"Another day, another illegal billion-dollar bribe to raise your electricity prices",https://electrek.co/2026/06/30/another-day-another-illegal-billion-dollar-bribe-to-raise-your-electricity-prices/,2026-06-30 15:50:00,
20260630,electrek,新能源,Tesla begins ‘engineering tests’ of first production Cybercab in Austin,https://electrek.co/2026/06/30/tesla-cybercab-engineering-tests-austin/,2026-06-30 14:56:45,
20260630,electrek,新能源,"Jeep scraps two EVs in Europe, but three new SUVs are on the way",https://electrek.co/2026/06/30/jeep-scraps-two-evs-europe-three-new-suvs/,2026-06-30 14:27:08,
20260630,electrek,新能源,"Beachman unveils new Aviator electric bike lineup, with upcoming 125cc-equivalent model",https://electrek.co/2026/06/30/beachman-unveils-new-aviator-electric-bike-lineup-with-upcoming-125cc-equivalent-model/,2026-06-30 14:15:26,
20260630,electrek,新能源,New CPSC rule could dramatically change e-bikes in the US,https://electrek.co/2026/06/29/new-cpsc-rule-could-dramatically-change-e-bikes-in-the-us/,2026-06-30 05:40:46,
20260630,scitechdaily,综合科技,This Surprising Factor May Predict Heart Disease Decades Before It Strikes,https://scitechdaily.com/this-surprising-factor-may-predict-heart-disease-decades-before-it-strikes/,2026-06-30 23:30:34,
20260630,scitechdaily,综合科技,New Nonsurgical Knee Treatment Delivers Lasting Pain Relief,https://scitechdaily.com/new-nonsurgical-knee-treatment-delivers-lasting-pain-relief/,2026-06-30 22:55:56,
20260630,scitechdaily,综合科技,Scientists Discover Hidden Rule That Could Make Fuel Cells Cheaper and More Powerful,https://scitechdaily.com/scientists-discover-hidden-rule-that-could-make-fuel-cells-cheaper-and-more-powerful/,2026-06-30 20:56:17,
20260630,scitechdaily,综合科技,New Water-Harvesting Jacket Pulls up to 30 Ounces of Drinking Water From the Air Daily,https://scitechdaily.com/new-water-harvesting-jacket-pulls-up-to-30-ounces-of-drinking-water-from-the-air-daily/,2026-06-30 20:21:30,
20260630,scitechdaily,综合科技,Scientists Finally Uncover Why Gold Never Tarnishes,https://scitechdaily.com/scientists-finally-uncover-why-gold-never-tarnishes/,2026-06-30 19:46:28,
20260630,scitechdaily,综合科技,Scientists Uncover a Previously Unknown Lineage of Ancient Marsupials,https://scitechdaily.com/scientists-uncover-a-previously-unknown-lineage-of-ancient-marsupials/,2026-06-30 11:56:12,
20260630,scitechdaily,综合科技,Critically Endangered Monkey Defies the Odds With New Baby After Surgery,https://scitechdaily.com/critically-endangered-monkey-defies-the-odds-with-new-baby-after-surgery/,2026-06-30 11:21:42,
20260630,scitechdaily,综合科技,17-Million-Year-Old Ape Fossil in Egypt Could Change What We Know About Human Origins,https://scitechdaily.com/17-million-year-old-ape-fossil-in-egypt-could-change-what-we-know-about-human-origins/,2026-06-30 10:46:38,
20260630,interesting_engineering,综合科技,Japan develops world-class system to monitor fusion plasma at 34 points simultaneously,https://interestingengineering.com/innovation/japan-fusion-plasma-measurement-system,2026-06-30 23:57:54,
20260630,interesting_engineering,综合科技,NASA commits $590 million to four Moon missions for permanent lunar outpost,https://interestingengineering.com/space/nasa-expands-moon-base-with-four-lunar-missions,2026-06-30 23:31:53,
20260630,interesting_engineering,综合科技,US Marine Corps buys first autonomous ground vehicle fleet to run frontline missions,https://interestingengineering.com/military/marine-corps-autonomous-ground-vehicles,2026-06-30 22:51:18,
20260630,interesting_engineering,综合科技,US Air Force validates Japanese edge computing chip for battlefield missions,https://interestingengineering.com/military/edgecortix-sakura-ii-us-air-force-edge-computing,2026-06-30 22:04:47,
20260630,interesting_engineering,综合科技,Hydrogen electrolyzer to adapt for fusion fuel by extracting tritium from heavy water,https://interestingengineering.com/energy/next-hydrogen-electrolyzer-fusion-fuel,2026-06-30 20:14:11,
20260630,interesting_engineering,综合科技,US company recovers 99.9 percent pure rare earth oxides from secondary sources,https://interestingengineering.com/innovation/us-rare-earth-recycling-china-dependence,2026-06-30 19:11:44,
20260630,interesting_engineering,综合科技,China launches $210M diamond semiconductor project to power next-generation chips,https://interestingengineering.com/innovation/china-diamond-semiconductor-industrial-chain-project,2026-06-30 18:58:07,
20260630,interesting_engineering,综合科技,Orbital propellant depots move closer to reality with NASA cryocoupler tests,https://interestingengineering.com/space/orbital-propellant-depots-move-closer-to-reality-with-nasa-cryocoupler-tests,2026-06-30 17:50:10,
20260630,interesting_engineering,综合科技,Abrams vs T-90: How US’s and Russia’s flagship battle tanks compare,https://interestingengineering.com/military/abrams-vs-t-90-comparison,2026-06-30 16:51:03,
20260630,interesting_engineering,综合科技,Patriot vs S-400: Comparing two of the world’s most advanced air defense systems,https://interestingengineering.com/military/how-the-worlds-two-leading-air-defense-systems-compare,2026-06-30 16:38:55,
20260630,perovskite_info,光伏,Maxwell delivers first commercial perovskite‑HJT tandem cell production line - Perovskite-Info,https://news.google.com/rss/articles/CBMirAFBVV95cUxNbWJUSGZ1b2ViWmh4Vy01RkdJaDRfYmxDR0lEVGhZS0JfOFVld3MtVnZncVhvaTdzSjd2TllpY09sN0piQ1drN3pidF8yR2xLTkFjNGdOS0VvSGh6QkF5OEljYnpuWlQ5M1RYNy01bGg5TVZDQ0t5OXRvWmp5dGM1bGU0VTRzdUV2aExpWFlraEczRy1OXzJEeUZXN2t0WWw1eU81UG5ydWRHTWFn?oc=5,2026-06-30 12:44:48,
20260630,cnnpn_domestic,核电国内,红沿河核电公司召开2026年冷源保障工作动员会6月29日，红沿河公司召开2026年冷源保障工作动员会，研究当前冷源保障各项工作开展情况，部署推进后续工作。公司党委书记、董事长左裕轩为15支冷源保障攻坚队授旗并作动员讲话。公司领导张卫东、俞家明、缪冬等参加动员会。左裕轩强调，今年是红沿河核电冷源防抗攻坚的第三年，取水安全事关核安全、电网安全和能源保供安全，责任重如泰山。要认真贯彻落实党中央、国务院关于安全生产、迎峰度夏等工作的部署要求，坚决扛起政治责任，牢固树立和践行...2026-06-30,https://www.cnnpn.cn/article/55499.html,2026-06-30 00:00:00,
20260630,cnnpn_domestic,核电国内,中广核数科参加第二届数智化促进核能新质生产力发展会议近期，以核拥AI・智启未来为主题的第二届数智化促进核能新质生产力发展会议在宁波召开。本次会议由中国核学会数字化与人工智能分会主办，汇聚全国核能领域、数字化与人工智能行业的专家、企业代表、科研院所与高校学者，共话数智技术与核能全产业链深度融合，共谋核能新质生产力高质量发展新路径。中广核数科受邀参加大会，并组织专题6数智化核电仪控、参加专题10数字华龙专题研讨会，呈现核能数智化创新成果与实践新路径。数智化核电仪控专题...2026-06-30,https://www.cnnpn.cn/article/55461.html,2026-06-30 00:00:00,
20260630,cnnpn_domestic,核电国内,尹卫平调研金七门、三门核电项目：转理念、强本领、提质效 以高质量履约推动战略落地6月27日至28日，公司党委书记、董事长尹卫平深入金七门、三门核电项目现场开展调研，实地查看工程建设进度、安全质量管控、四新技术应用，并走访了解一线职工生活保障情况。尹卫平强调，项目部是经营管理单元，全体管理人员要深入学习贯彻公司转理念、强本领、提质效专题研讨会议精神，主动更新项目管理思路，持续锤炼专业履职能力，靶向破解项目建设各类难题，多措并举优化施工组织与资源配置，以全方位质效提升推动项目高标准建设。针对下一步工作，尹...2026-06-30,https://www.cnnpn.cn/article/55458.html,2026-06-30 00:00:00,
20260630,cnnpn_domestic,核电国内,核电厂仪控防非停技术交流会在苍南成功召开6月23日，由中国核能行业协会核电运行技术委员会主办，苏州热工研究院有限公司承办，中广核苍南核电有限公司协办的核电厂仪控防非停技术交流会在苍南核电现场顺利召开，来自协会22家会员单位的40余位专家代表参会。会议以有效预防仪控设备非计划停堆为主题，围绕仪控系统可靠性提升与单点故障消除、DCS健康管理与状态监测技术、柴油机及关键设备故障分析与优化、智能诊断/信号链路与控制逻辑优化四个主题展开深入讨论，不仅关注仪控防非停问题，...2026-06-30,https://www.cnnpn.cn/article/55456.html,2026-06-30 00:00:00,
20260630,cnnpn_domestic,核电国内,中核二二召开组织机构改革宣贯会6月29日，中核二二召开组织机构改革宣贯会暨新机构揭牌启动仪式，全面落实公司机构改革整体工作部署，进一步凝聚全员思想共识、明晰改革实施路径、压实各级管理责任，推动机构改革各项任务走深走实，为公司新阶段高质量发展夯基赋能。会议传达了中核集团调研中核二二高质量发展专题会议精神，宣贯了《组织机构改革方案》，宣读了干部聘任相关文件，并听取相关领域建设工作方案，与新组织机构各部门负责人签订了经营责任书，强调要进一步转理念、强本领...2026-06-30,https://www.cnnpn.cn/article/55454.html,2026-06-30 00:00:00,
20260630,cnnpn_domestic,核电国内,海阳核电二期工程大型模块全部吊装完成6月29日13时39分，海阳核电二期工程最后一个大型模块——4号机组CB20模块顺利吊装就位，标志着海阳核电二期工程全面进入安装、调试阶段。海阳核电二期工程是国家十五五规划重点项目，已按计划完成45个里程碑节点。本次吊装的CB20模块是非能动安全壳冷却系统的重要组成部分，由内外两层圆柱形墙板、顶板及锥底板组成，位于核岛屏蔽厂房顶部，直径约26米，高约10米，吊装总重量约419吨，可储水3000余吨。海阳核电项目建设团队全体，立足岗位、勇担重任。...2026-06-30,https://www.cnnpn.cn/article/55452.html,2026-06-30 00:00:00,
20260630,cnnpn_domestic,核电国内,大连大高阀门获中广核、国电投、华能三大央企联合战略增资6月26日，大连大高阀门股份有限公司战略增资签约仪式在一方城堡酒店隆重举行。本轮重磅产业增资，成功引入中广核资本、国家电投、华能国内三大能源央企。三家企业手握国内稀缺的全品类能源运营核心资质，覆盖核电、火电、新能源、综合能源全赛道，是国家核安全局批复的四家营运持证主体之三。其中，中广核是国内核电运营龙头企业，在运、在建核电机组规模领先，经营布局稳健;国家电投是全球规模领先的清洁能源企业，持续承担多项国家能源重大专项攻...2026-06-30,https://www.cnnpn.cn/article/55451.html,2026-06-30 00:00:00,
20260630,cnnpn_domestic,核电国内,杨才明任中国中原对外工程有限公司党委副书记、推荐为董事6月29日，中国中原对外工程有限公司召开干部大会，宣布中核集团党组关于中国中原领导班子调整的有关决定：杨才明同志任中共中国中原对外工程有限公司委员会副书记，推荐杨才明为中国中原对外工程有限公司董事。中国中原党委副书记、总经理毛亚蔚同志宣读任职决定，党委书记、董事长王永革同志主持会议并讲话。会上，杨才明同志作表态发言，表示完全拥护、坚决服从中核集团党组的决定。王永革代表公司领导班子作表态发言，此次中国中原领导干部调整...2026-06-30,https://www.cnnpn.cn/article/55450.html,2026-06-30 00:00:00,
20260630,cnnpn_domestic,核电国内,大连大高阀门获中广核、国电投、华能三大央企联合战略增资,https://www.cnnpn.cn/article/55451.html,,
20260630,cnnpn_domestic,核电国内,红沿河核电公司召开2026年冷源保障工作动员会,https://www.cnnpn.cn/article/55499.html,,
20260630,cnnpn_domestic,核电国内,中广核数科参加第二届数智化促进核能新质生产力发展会议,https://www.cnnpn.cn/article/55461.html,,
20260630,cnnpn_domestic,核电国内,海阳核电二期工程大型模块全部吊装完成,https://www.cnnpn.cn/article/55452.html,,
20260630,cnnpn_domestic,核电国内,尹卫平调研金七门、三门核电项目：转理念、强本领、提质效 以高质量履约推动战略落地,https://www.cnnpn.cn/article/55458.html,,
20260630,cnnpn_domestic,核电国内,中核二二召开组织机构改革宣贯会,https://www.cnnpn.cn/article/55454.html,,
20260630,cnnpn_domestic,核电国内,杨才明任中国中原对外工程有限公司党委副书记、推荐为董事,https://www.cnnpn.cn/article/55450.html,,
20260630,cnnpn_domestic,核电国内,核电厂仪控防非停技术交流会在苍南成功召开,https://www.cnnpn.cn/article/55456.html,,
20260630,cnnpn_domestic,核电国内,中国聚变天府聚变技术研发中心二期项目正式开工,https://www.cnnpn.cn/article/55504.html,,
20260630,cnnpn_domestic,核电国内,上海核工院部门主要负责人研讨班（头雁计划）圆满结业,https://www.cnnpn.cn/article/55449.html,,
20260630,cnnpn_domestic,核电国内,董保同在核工业学院天津校区出席核安全监管初任班结业式 讲授专题党课并开展调研,https://www.cnnpn.cn/article/55501.html,,
20260630,cnnpn_domestic,核电国内,中广核广东太平岭核电项目2号机组首次核蒸汽冲转圆满成功,https://www.cnnpn.cn/article/55443.html,,
20260630,cnnpn_domestic,核电国内,国内首套！国家电投集团电投核能自研纯国产核电检修检测装备投用,https://www.cnnpn.cn/article/55395.html,,
20260630,cnnpn_domestic,核电国内,江苏核电召开2026年度迎峰度夏专项工作启动会,https://www.cnnpn.cn/article/55503.html,,
20260630,cnnpn_domestic,核电国内,中方参加多国设计评价计划VVER工作组第26次会议,https://www.cnnpn.cn/article/55444.html,,
20260630,cnnpn_international,核电国外,英国最新选址研究称苏格兰具备新核能开发高潜力,https://www.cnnpn.cn/article/55493.html,,
20260630,cnnpn_international,核电国外,韩国现代建设与韩国东南电力推进燃煤电厂SMR改造技术,https://www.cnnpn.cn/article/55083.html,,
20260630,cnnpn_international,核电国外,Bruce完成了迄今为止最大的放射性同位素交付,https://www.cnnpn.cn/article/39895.html,,
20260630,cnnpn_international,核电国外,科技巨头Meta加速核电投资 与Vistra、Oklo和TerraPower达成三项新协议,https://www.cnnpn.cn/article/51137.html,,
20260630,cnnpn_international,核电国外,韩国现代工程与韩国聚变能源研究院签署协议，合作开发韩国式聚变反应堆技术,https://www.cnnpn.cn/article/54783.html,,
20260630,cnnpn_international,核电国外,Realta Fusion首次演示聚变等离子体动能直接发电,https://www.cnnpn.cn/article/55516.html,,
20260630,cnnpn_international,核电国外,土耳其考虑在下一代核电站项目中采用加拿大技术,https://www.cnnpn.cn/article/55048.html,,
20260630,cnnpn_international,核电国外,韩国与斯洛伐克签署氢能合作备忘录，聚焦核能制氢,https://www.cnnpn.cn/article/54949.html,,
20260630,cnnpn_international,核电国外,Studsvik获NRC批准扩展其核反应堆软件适用范围，涵盖下一代反应堆,https://www.cnnpn.cn/article/54715.html,,
20260630,cnnpn_international,核电国外,ITER中心螺线管完成堆叠：全球最大脉冲超导电磁体达到整体高度,https://www.cnnpn.cn/article/55498.html,,
20260630,cnnpn_international,核电国外,AMPERA推出集成能源架构，计划2027年底前部署首批发电系统,https://www.cnnpn.cn/article/55290.html,,
20260630,cnnpn_international,核电国外,Kairos Power在新墨西哥州生产6万颗环形替代燃料球,https://www.cnnpn.cn/article/55293.html,,
20260630,cnnpn_international,核电国外,麻省理工团队创办Ferveret 借核反应堆冷却技术降低数据中心能耗,https://www.cnnpn.cn/article/54823.html,,
20260630,cnnpn_international,核电国外,Rolls-Royce SMR具备潜力用于制氢,https://www.cnnpn.cn/article/37345.html,,
20260630,cnnpn_international,核电国外,Hadron聘请DLA Piper推进Halo微型模块化反应堆许可与融资,https://www.cnnpn.cn/article/55497.html,,
20260630,sciencenet,综合科技,闭环脑机接口体系为神经痛诊疗提供全新方案,https://news.sciencenet.cn/htmlnews/2026/6/567450.shtm,2026-06-30 00:00:00,
20260630,sciencenet,综合科技,新研究改写急性硬膜外血肿脑疝全球诊疗方案,https://news.sciencenet.cn/htmlnews/2026/6/567427.shtm,2026-06-30 00:00:00,
